{
  "incident_id": "incident_env_123_storage_pressure",
  "organization_id": "org_123",
  "project_id": "project_123",
  "environment_id": "env_123",
  "title": "Managed Postgres storage pressure",
  "summary": "The local smoke environment is reporting storage pressure for status page coverage.",
  "severity": "warning",
  "status": "investigating",
  "impacted_services": ["managed_postgres", "sync_gateway"],
  "started_at": "2026-05-18T12:00:00Z",
  "resolved_at": null
}
